{
  "$schema": "https://json-schema.org/draft/2020-12/schema",
  "$id": "https://github.com/rezahh107/PR-Inspector/schemas/aigov/v2.5.0/publication_attempt.schema.json",
  "title": "AIGOV Inactive Publication Attempt Contract",
  "description": "Inactive, non-authoritative append-only publication attempt envelope separate from Receipt Core.",
  "type": "object",
  "additionalProperties": false,
  "properties": {
    "contract_type": {
      "const": "publication_attempt"
    },
    "contract_version": {
      "const": "1.0"
    },
    "activation_state": {
      "const": "inactive"
    },
    "publication_attempt_id": {
      "$ref": "common.schema.json#/$defs/record_id"
    },
    "attempt_number": {
      "$ref": "common.schema.json#/$defs/positive_integer"
    },
    "review_id": {
      "$ref": "common.schema.json#/$defs/record_id"
    },
    "receipt_core_digest": {
      "$ref": "common.schema.json#/$defs/tagged_sha256"
    },
    "publication_status": {
      "$ref": "common.schema.json#/$defs/receipt_publication_status"
    },
    "receipt_validation_status": {
      "enum": [
        "not_checked",
        "current_valid",
        "stale",
        "invalid",
        "conflicting"
      ]
    },
    "carrier": {
      "enum": [
        "structured_pr_comment",
        "github_check_run",
        "immutable_ledger_pointer",
        "repository_defined"
      ]
    },
    "publisher_identity": {
      "type": "object",
      "additionalProperties": false,
      "properties": {
        "actor_login": {
          "$ref": "common.schema.json#/$defs/non_empty_string"
        },
        "actor_id": {
          "$ref": "common.schema.json#/$defs/positive_integer"
        },
        "actor_type": {
          "enum": [
            "User",
            "Bot",
            "App"
          ]
        },
        "github_app_id": {
          "type": [
            "integer",
            "null"
          ],
          "minimum": 1
        },
        "installation_id": {
          "type": [
            "integer",
            "null"
          ],
          "minimum": 1
        }
      },
      "required": [
        "actor_login",
        "actor_id",
        "actor_type",
        "github_app_id",
        "installation_id"
      ]
    },
    "target_repository_full_name": {
      "type": "string",
      "pattern": "^[^/\\s]+/[^/\\s]+$"
    },
    "target_repository_id": {
      "$ref": "common.schema.json#/$defs/positive_integer"
    },
    "pr_number": {
      "$ref": "common.schema.json#/$defs/positive_integer"
    },
    "head_observed_at_publish": {
      "$ref": "common.schema.json#/$defs/git_commit_sha"
    },
    "published_object_id": {
      "type": [
        "integer",
        "string",
        "null"
      ],
      "minLength": 1
    },
    "published_at": {
      "anyOf": [
        {
          "$ref": "common.schema.json#/$defs/timestamp"
        },
        {
          "type": "null"
        }
      ]
    },
    "readback_verified_at": {
      "anyOf": [
        {
          "$ref": "common.schema.json#/$defs/timestamp"
        },
        {
          "type": "null"
        }
      ]
    },
    "published_body_sha256": {
      "anyOf": [
        {
          "$ref": "common.schema.json#/$defs/sha256"
        },
        {
          "type": "null"
        }
      ]
    },
    "failure_reason": {
      "type": [
        "string",
        "null"
      ],
      "minLength": 1
    },
    "readback_status": {
      "$ref": "common.schema.json#/$defs/tool_readback_status"
    },
    "readback_evidence_ref": {
      "$ref": "common.schema.json#/$defs/nullable_evidence_reference"
    },
    "idempotency_key": {
      "type": "object",
      "additionalProperties": false,
      "properties": {
        "review_id": {
          "$ref": "common.schema.json#/$defs/record_id"
        },
        "repository_id": {
          "$ref": "common.schema.json#/$defs/positive_integer"
        },
        "pr_number": {
          "$ref": "common.schema.json#/$defs/positive_integer"
        },
        "reviewed_head_sha": {
          "$ref": "common.schema.json#/$defs/git_commit_sha"
        },
        "receipt_core_digest": {
          "$ref": "common.schema.json#/$defs/tagged_sha256"
        }
      },
      "required": [
        "review_id",
        "repository_id",
        "pr_number",
        "reviewed_head_sha",
        "receipt_core_digest"
      ]
    },
    "prior_attempt_ref": {
      "anyOf": [
        {
          "$ref": "common.schema.json#/$defs/record_reference"
        },
        {
          "type": "null"
        }
      ]
    },
    "conflicting_receipt_ref": {
      "anyOf": [
        {
          "$ref": "common.schema.json#/$defs/record_reference"
        },
        {
          "type": "null"
        }
      ]
    }
  },
  "required": [
    "contract_type",
    "contract_version",
    "activation_state",
    "publication_attempt_id",
    "attempt_number",
    "review_id",
    "receipt_core_digest",
    "publication_status",
    "receipt_validation_status",
    "carrier",
    "publisher_identity",
    "target_repository_full_name",
    "target_repository_id",
    "pr_number",
    "head_observed_at_publish",
    "published_object_id",
    "published_at",
    "readback_verified_at",
    "published_body_sha256",
    "failure_reason",
    "readback_status",
    "readback_evidence_ref",
    "idempotency_key",
    "prior_attempt_ref",
    "conflicting_receipt_ref"
  ],
  "allOf": [
    {
      "if": {
        "properties": {
          "publication_status": {
            "const": "published_verified"
          }
        },
        "required": [
          "publication_status"
        ]
      },
      "then": {
        "properties": {
          "published_object_id": {
            "not": {
              "type": "null"
            }
          },
          "published_at": {
            "$ref": "common.schema.json#/$defs/timestamp"
          },
          "readback_verified_at": {
            "$ref": "common.schema.json#/$defs/timestamp"
          },
          "published_body_sha256": {
            "$ref": "common.schema.json#/$defs/sha256"
          },
          "failure_reason": {
            "type": "null"
          },
          "readback_status": {
            "const": "VERIFIED"
          },
          "readback_evidence_ref": {
            "$ref": "common.schema.json#/$defs/evidence_reference"
          }
        }
      }
    },
    {
      "if": {
        "properties": {
          "publication_status": {
            "const": "publication_failed"
          }
        },
        "required": [
          "publication_status"
        ]
      },
      "then": {
        "properties": {
          "failure_reason": {
            "type": "string"
          }
        }
      }
    },
    {
      "if": {
        "properties": {
          "receipt_validation_status": {
            "const": "conflicting"
          }
        },
        "required": [
          "receipt_validation_status"
        ]
      },
      "then": {
        "properties": {
          "conflicting_receipt_ref": {
            "$ref": "common.schema.json#/$defs/record_reference"
          }
        }
      },
      "else": {
        "properties": {
          "conflicting_receipt_ref": {
            "type": "null"
          }
        }
      }
    }
  ]
}
