{"contract_type":"publication_attempt","contract_version":"1.0","activation_state":"inactive","publication_attempt_id":"attempt-001","attempt_number":1,"review_id":"review-001","receipt_core_digest":"sha256:aaaaaaaaaaaaaaaaaaaaaaaaaaaaaaaaaaaaaaaaaaaaaaaaaaaaaaaaaaaaaaaa","publication_status":"published_verified","receipt_validation_status":"current_valid","carrier":"structured_pr_comment","publisher_identity":{"actor_login":"publisher-bot","actor_id":100,"actor_type":"Bot","github_app_id":200,"installation_id":300},"target_repository_full_name":"rezahh107/example","target_repository_id":42,"pr_number":7,"head_observed_at_publish":"1111111111111111111111111111111111111111","published_object_id":900,"published_at":"2026-07-18T12:00:00Z","readback_verified_at":"2026-07-18T12:00:05Z","published_body_sha256":"bbbbbbbbbbbbbbbbbbbbbbbbbbbbbbbbbbbbbbbbbbbbbbbbbbbbbbbbbbbbbbbb","failure_reason":null,"readback_status":"VERIFIED","readback_evidence_ref":{"evidence_id":"readback-1","evidence_type":"structured_record","exact_identity":"comment-900","source_digest":"sha256:cccccccccccccccccccccccccccccccccccccccccccccccccccccccccccccccc","retrieval_method":"github_api"},"idempotency_key":{"review_id":"review-001","repository_id":42,"pr_number":7,"reviewed_head_sha":"1111111111111111111111111111111111111111","receipt_core_digest":"sha256:aaaaaaaaaaaaaaaaaaaaaaaaaaaaaaaaaaaaaaaaaaaaaaaaaaaaaaaaaaaaaaaa"},"prior_attempt_ref":null,"conflicting_receipt_ref":null}
